title,authors,published,summary,keywords
Simulation-based inference with scattering representations: scattering is all you need,"Kiyam Lin, Benjamin Joachimi, Jason D. McEwen",2024-10-11,"We demonstrate the first successful use of scattering representations without
further compression for simulation-based inference (SBI) with images (i.e.
field-level), illustrated with a cosmological case study. Scattering
representations provide a highly effective representational space for
subsequent learning tasks, although the higher dimensional compressed space
introduces challenges. We overcome these through spatial averaging, coupled
with more expressive density estimators. Compared to alternative methods, such
an approach does not require additional simulations for either training or
computing derivatives, is interpretable, and resilient to covariate shift. As
expected, we show that a scattering only approach extracts more information
than traditional second order summary statistics.",all you need
Noise is All You Need: Private Second-Order Convergence of Noisy SGD,"Dmitrii Avdiukhin, Michael Dinitz, Chenglin Fan, Grigory Yaroslavtsev",2024-10-09,"Private optimization is a topic of major interest in machine learning, with
differentially private stochastic gradient descent (DP-SGD) playing a key role
in both theory and practice. Furthermore, DP-SGD is known to be a powerful tool
in contexts beyond privacy, including robustness, machine unlearning, etc.
Existing analyses of DP-SGD either make relatively strong assumptions (e.g.,
Lipschitz continuity of the loss function, or even convexity) or prove only
first-order convergence (and thus might end at a saddle point in the non-convex
setting). At the same time, there has been progress in proving second-order
convergence of the non-private version of ``noisy SGD'', as well as progress in
designing algorithms that are more complex than DP-SGD and do guarantee
second-order convergence. We revisit DP-SGD and show that ``noise is all you
need'': the noise necessary for privacy already implies second-order
convergence under the standard smoothness assumptions, even for non-Lipschitz
loss functions. Hence, we get second-order convergence essentially for free:
DP-SGD, the workhorse of modern private optimization, under minimal assumptions
can be used to find a second-order stationary point.",all you need
Is Pontryagin's Maximum Principle all you need? Solving optimal control problems with PMP-inspired neural networks,"Kawisorn Kamtue, Jose M. F. Moura, Orathai Sangpetch",2024-10-08,"Calculus of Variations is the mathematics of functional optimization, i.e.,
when the solutions are functions over a time interval. This is particularly
important when the time interval is unknown like in minimum-time control
problems, so that forward in time solutions are not possible. Calculus of
Variations offers a robust framework for learning optimal control and
inference. How can this framework be leveraged to design neural networks to
solve challenges in control and inference? We propose the Pontryagin's Maximum
Principle Neural Network (PMP-net) that is tailored to estimate control and
inference solutions, in accordance with the necessary conditions outlined by
Pontryagin's Maximum Principle. We assess PMP-net on two classic optimal
control and inference problems: optimal linear filtering and minimum-time
control. Our findings indicate that PMP-net can be effectively trained in an
unsupervised manner to solve these problems without the need for ground-truth
data, successfully deriving the classical ""Kalman filter"" and ""bang-bang""
control solution. This establishes a new approach for addressing general,
possibly yet unsolved, optimal control problems.",all you need
Grounding is All You Need? Dual Temporal Grounding for Video Dialog,"You Qin, Wei Ji, Xinze Lan, Hao Fei, Xun Yang, Dan Guo, Roger Zimmermann, Lizi Liao",2024-10-08,"In the realm of video dialog response generation, the understanding of video
content and the temporal nuances of conversation history are paramount. While a
segment of current research leans heavily on large-scale pretrained
visual-language models and often overlooks temporal dynamics, another delves
deep into spatial-temporal relationships within videos but demands intricate
object trajectory pre-extractions and sidelines dialog temporal dynamics. This
paper introduces the Dual Temporal Grounding-enhanced Video Dialog model
(DTGVD), strategically designed to merge the strengths of both dominant
approaches. It emphasizes dual temporal relationships by predicting dialog
turn-specific temporal regions, filtering video content accordingly, and
grounding responses in both video and dialog contexts. One standout feature of
DTGVD is its heightened attention to chronological interplay. By recognizing
and acting upon the dependencies between different dialog turns, it captures
more nuanced conversational dynamics. To further bolster the alignment between
video and dialog temporal dynamics, we've implemented a list-wise contrastive
learning strategy. Within this framework, accurately grounded turn-clip
pairings are designated as positive samples, while less precise pairings are
categorized as negative. This refined classification is then funneled into our
holistic end-to-end response generation mechanism. Evaluations using
AVSD@DSTC-7 and AVSD@DSTC-8 datasets underscore the superiority of our
methodology.",all you need
Multicritical-Point Principle Is All You Need for Toponium,Yoshiki Matsuoka,2024-10-07,"In this paper, the coupling constant of a newly discovered top quark pair is
predicted. For this purpose, this paper considers a pseudo scalar mediating top
quarks. For predicting the coupling constant, the multicritical-point principle
(MPP) is used to determine the effective potential. And a few remarks will be
made on the non-perturbative effects of toponium. As a result, the coupling
constant of a newly discovered top quark pair is predicted to be about
$0.85$--$0.86$. The pseudo scalar field is also found to improve the vacuum
stability associated with the Higgs field.",all you need
